city_id,city_name,name,booking_link,score,lat,lon,descr
16,Grenoble,RockyPop Grenoble Hotel,https://www.booking.com/hotel/fr/rockypop-grenoble.fr.html,8.5,45.18691100,5.73129300,"Situé à Grenoble, à 1,6 km de la gare, le RockyPop Grenoble Hotel propose une salle de sport, un parking privé, un jardin et une terrasse. Cet hôtel 4 étoiles dispose d'une connexion Wi-Fi gratuite, d'un restaurant et d'un bar. L'hôtel possède un sauna et une réception ouverte 24h/24.
Les chambres climatisées comprennent un bureau, une machine à café, un coffre-fort, une télévision à écran plat et une salle de bains privative avec baignoire ou douche. Elles comprennent également une armoire et une bouilloire.
Un petit-déjeuner buffet est servi chaque matin.
Vous pourrez jouer au ping-pong sur place.
Vous séjournerez à 1,9 km du WTC Grenoble et à 4,8 km d'AlpExpo. L'aéroport le plus proche, celui des Alpes-Isère, est situé à 48 km. 
"
16,Grenoble,Kyriad Grenoble Centre,https://www.booking.com/hotel/fr/qualityhotelgrenoble.fr.html,7.6,45.16819994,5.71199477,"Situé à Grenoble, à 200 mètres du stade Lesdiguières, le Kyriad Grenoble Centre vous accueille dans un hôtel 3 étoiles doté d'une réception ouverte 24h/24 et d'une connexion Wi-Fi gratuite. Le centre de conventions Alpexpo se trouve à 3 km. Vous pourrez profiter gratuitement d'un parking privé sous surveillance vidéo.
Toutes les chambres comprennent la climatisation, une télévision par satellite à écran plat avec Canal + notamment et un plateau/bouilloire. Leur salle de bains privative est pourvue d'une baignoire et d'articles de toilette offerts.
Le service d'étage et le bar sont disponibles 24h/24 et 7j/7. Le matin, vous pourrez déguster un petit-déjeuner buffet.
Le téléphérique de Grenoble-La Bastille se trouve à 4 km, tandis que la gare de Grenoble, placée à 3 km, est accessible en 10 minutes en tramway. Enfin, l'aéroport de Grenoble-Isère est implanté à 46 km. 
"
18,Gorges du Verdon,Mas des Lavandes,https://www.booking.com/hotel/fr/mas-des-lavandes.fr.html,8.3,43.81484293,6.09714015,"Offrant une vue sur la mer, le Mas des Lavandes propose un hébergement avec un balcon et une bouilloire, à environ 38 km d'ITER / Cadarache. Cette maison de vacances propose gratuitement un parking privé, une connexion Wi-Fi et une réception ouverte 24h/24.
Cette maison de vacances comprend 4 chambres, 2 salles de bains, du linge de lit, des serviettes, une télévision à écran plat, un coin repas, une cuisine entièrement équipée et une terrasse avec vue sur le jardin. Pour plus de commodité, l'établissement peut fournir des serviettes et du linge de lit moyennant des frais supplémentaires.
Vous pourrez profiter d'une terrasse bien exposée. Vous pourrez vous baigner dans la piscine extérieure, vous détendre dans le jardin et utiliser le barbecue. La région est prisée pour pratiquer la pêche et la randonnée.
Vous séjournerez à 36 km du parcours de golf de Digne et à 42 km du golf du Luberon. L'aéroport de Marseille-Provence, le plus proche, est implanté à 109 km. 
"
18,Gorges du Verdon,Résidence Les Écureuils,https://www.booking.com/hotel/fr/residence-les-ecureuils-greoux-les-bains.fr.html,9.0,43.75309523,5.88853615,"Située à Gréoux-les-Bains, la Résidence Les Écureuils dispose d'une piscine, d'un service de prêt de vélos, d'un jardin et d'une connexion Wi-Fi gratuite. Elle offre une vue sur ce dernier.
La cuisine est équipée d'un lave-vaisselle, d'un micro-ondes, d'un réfrigérateur et d'une bouilloire.
Une terrasse bien exposée est présente.
Lors de votre séjour à la Résidence Les Écureuils, vous pourrez jouer au ping-pong sur place ou faire de la randonnée ou du vélo dans les environs.
Vous séjournerez à 19 km d'ITER / Cadarache et à 23 km du golf du Luberon. L'aéroport de Marseille-Provence, le plus proche, est implanté à 81 km. 
"
18,Gorges du Verdon,"La Maison du Courtil, Figue-Miel",https://www.booking.com/hotel/fr/le-courtil-studio-figue-miel.fr.html,8.8,43.84756337,6.22126416,"Offrant une vue sur la montagne, La Maison du Courtil, Figue-Miel propose un hébergement avec une terrasse et une machine à café, à environ 41 km du parcours de golf de Digne. Il offre une vue sur le jardin et dispose d'une connexion Wi-Fi gratuite.
Offrant une vue sur la ville, cet appartement dispose d'une terrasse, d'une chambre, d'un salon, d'une télévision à écran plat, d'une cuisine équipée avec un réfrigérateur et un four, ainsi que d'une salle de bains pourvue d'une douche. Les serviettes et le linge de lit sont fournis.
Après une journée de randonnée ou de pêche, vous pourrez vous détendre dans le jardin ou le coin salon commun.
L'aéroport de Marseille-Provence, le plus proche, est implanté à 123 km. 
"
18,Gorges du Verdon,Clos Augusta,https://www.booking.com/hotel/fr/clos-augusta.fr.html,8.6,43.81755696,6.09606973,"Le Clos Augusta est situé à Riez, à 35 km du parcours de golf de Digne et à 42 km du golf du Luberon, dans une région propice à la randonnée. Situé à 38 km d'ITER / Cadarache, l'établissement dispose d'un jardin et d'un parking privé gratuit.
Cet appartement comprend une chambre, une salle de bains, du linge de lit, des serviettes, une télévision à écran plat, un coin repas, une cuisine entièrement équipée et une terrasse avec vue sur la rivière. Pour plus de commodité, l'établissement peut fournir des serviettes et du linge de lit moyennant des frais supplémentaires.
Vous séjournerez à 300 mètres de Riez et à 3,1 km de Roumoules. L'aéroport de Marseille-Provence, le plus proche, est implanté à 109 km. 
"
18,Gorges du Verdon,Appart T3 au coeur de Gréoux-les-Bains,https://www.booking.com/hotel/fr/appart-t3-au-coeur-de-greoux-les-bains.fr.html,8.0,43.75883820,5.88445460,"L'Appart T3 au coeur de Gréoux-les-Bains est situé à Gréoux-les-Bains, à 18 km d'ITER/Cadarache et à 22 km du golf du Luberon, dans une région où vous pourrez faire du vélo. Offrant une vue sur la montagne, il dispose d'un casino et d'une connexion Wi-Fi gratuite dans l'ensemble de ses locaux.
Cet appartement de 2 chambres comprend un salon avec une télévision par satellite à écran plat, une cuisine entièrement équipée avec un réfrigérateur et un four ainsi qu'une salle de bains pourvue d'une douche. Les serviettes et le linge de lit sont fournis.
L'aéroport de Marseille-Provence, le plus proche, est implanté à 89 km. 
"
18,Gorges du Verdon,"La Maison du Courtil, Pistache-Chocolat",https://www.booking.com/hotel/fr/le-courtil-appartement-pistache-chocolat.fr.html,9.4,43.84756530,6.22126952,"Offrant une vue sur la ville, La Maison du Courtil, Pistache-Chocolat propose un hébergement avec une terrasse et un balcon, à environ 41 km du parcours de golf de Digne. Offrant une vue sur la montagne et la piscine, cet appartement dispose également d'une connexion Wi-Fi gratuite.
Cet appartement climatisé comprend une chambre, un salon, une cuisine entièrement équipée avec un réfrigérateur et une machine à café ainsi qu'une salle de bains pourvue d'une douche et d'un sèche-cheveux. Les serviettes et le linge de lit sont fournis.
Vous pourrez faire de la randonnée dans les environs.
L'aéroport de Marseille-Provence, le plus proche, est implanté à 123 km. 
"
18,Gorges du Verdon,Mazet Lavande,https://www.booking.com/hotel/fr/mazet-16-et-23-l-39-espai-route-d-39-allemagne-en-provence.fr.html,8.2,43.77717000,5.97227100,"Le Mazet Lavande est situé à Saint-Martin-de-Brômes, à 30 km du golf du Luberon, à 46 km du parcours de golf de Digne et à 2,4 km de Saint-Martin-de-Brômes. Situé à 26 km d'ITER / Cadarache, il dispose d'une piscine extérieure ouverte en saison et d'un parking privé gratuit.
Cette maison de vacances comprend une chambre, une salle de bains, du linge de lit, des serviettes, une télévision par satellite à écran plat, un coin repas, une cuisine entièrement équipée et une terrasse avec vue sur la montagne. Pour plus de commodité, l'établissement peut fournir des serviettes et du linge de lit moyennant des frais supplémentaires.
Vous séjournerez à 3,1 km d'Allemagne-en-Provence et à 8,6 km d'Albiosc. L'aéroport de Marseille-Provence, le plus proche, est implanté à 97 km. 
"
18,Gorges du Verdon,Residence de Plein Air Panoramique à la Porte des Gorges du Verdon,https://www.booking.com/hotel/fr/camping-panoramique-du-verdon.fr.html,8.6,43.83927457,6.49366021,"L’établissement Residence de Plein Air Panoramique à la Porte des Gorges du Verdon vous accueille au cœur des gorges du Verdon, à seulement 1 km de Castellane. Il propose une piscine chauffée pour les enfants, une piscine à débordement chauffée également et un terrain de volley-ball. Une connexion Wi-Fi est fournie gratuitement sur l’ensemble de son terrain.
Les mobile homes de l’établissement Résidence de Plein Air Panoramique disposent d'une terrasse privée offrant une vue panoramique sur Castellane. Leur kitchenette est équipée d’une cuisinière et d’un réfrigérateur-congélateur. Les serviettes de toilette et le linge de lit sont fournis.
Des viennoiseries et du pain frais sont proposés sur commande 24 heures à l’avance. Boutiques, boulangeries et restaurants vous attendent dans le centre-ville de Castellane.
Le parking privé sur place est gratuit. Vous pourrez acheter du miel, des épices et des objets artisanaux locaux sur le marché organisé une fois par semaine dans le centre-ville. 
"
18,Gorges du Verdon,Camping Calme et Nature,https://www.booking.com/hotel/fr/calme-et-nature-castellane.fr.html,8.8,43.83796907,6.49042815,"Le Camping Calme et Nature est situé au cœur des Gorges du Verdon, à 765 mètres d'altitude et à seulement 2 km de Castellane. Il possède un barbecue et une terrasse bien exposée. Il est situé dans le parc naturel régional du Verdon. La connexion Wi-Fi est gratuite.
Tous les logements comportent un coin salon/repas. Leur kitchenette est équipée d'un micro-ondes, d'un réfrigérateur, d'un coin salon et/ou d'une terrasse. Leur salle de bains privative est pourvue d'une douche.
Vous pourrez prendre un verre au bar et jouer au tennis de table sur place. Un service de prêt de vélos est assuré. Vous rejoindrez le village de Castellane par le sentier de randonnée GR4, accessible à pied ou en vélo.
Grasse est accessible à 66 km du Camping Calme et Nature, tandis que Gréoux-les-Bains se trouve à 77 km. L'aéroport le plus proche, celui de Nice-Côte d'Azur, se situe à 86 km. 
"
18,Gorges du Verdon,Les Bastides de Chanteraine,https://www.booking.com/hotel/fr/les-bastides-de-chanteraine.fr.html,8.3,43.76273431,6.21918202,"Offrant une vue sur la montagne, l'établissement Les Bastides de Chanteraine est situé à Aiguines. Il propose une piscine extérieure ouverte en saison, un jardin, une terrasse, un restaurant et un bar.
Vous disposerez également d'un réfrigérateur, de plaques de cuisson et d'une machine à café.
Ce camping sert un petit-déjeuner continental ou à la carte.
L'aéroport de Toulon-Hyères, le plus proche, est implanté à 113 km. 
"
18,Gorges du Verdon,Camping Frédéric Mistral,https://www.booking.com/hotel/fr/camping-fra-c-da-c-ric-mistral.fr.html,8.0,43.84615569,6.50986075,"Le camping Frédéric Mistral est situé dans le centre-ville de Castellane, à seulement 4 km du lac de Castillon et à 100 mètres de la place du marché et des commerces. Il vous permettra de découvrir la campagne de Haute-Provence. Vous bénéficierez gratuitement d'une connexion Wi-Fi dans les parties communes.
Les chalets et les mobile homes du Frédéric Mistral sont installés à l'ombre des arbres. Ils comportent tous une entrée privée, un balcon et un salon doté d'une kitchenette décloisonnée avec des plaques de cuisson, un micro-ondes et une cafetière.
Cet établissement propose un petit-déjeuner continental et dispose d'un hotspot Wi-Fi gratuit sur place. Une blanchisserie et une table de ping-pong sont également à votre disposition.
Vous pourrez vous garer gratuitement sur un emplacement de stationnement privé. Les gorges du Verdon, où vous trouverez des sentiers de randonnée et des itinéraires à découvrir en canoë-kayak, sont situées à moins de 18 km du Camping Frédéric Mistral. 
"
18,Gorges du Verdon,Le gite du grand cèdre - proche des gorges du Verdon,https://www.booking.com/hotel/fr/le-gite-du-grand-cedre.fr.html,9.3,43.77929309,6.00733668,"Le gite du grand cèdre - proche des gorges du Verdon est situé à Allemagne-en-Provence, à 29 km d'ITER / Cadarache et à 34 km du golf du Luberon, dans une région propice à la randonnée. Cette maison de vacances dispose d'un jardin, d'un barbecue, ainsi que d'une connexion Wi-Fi et d'un parking privé gratuits.
Offrant une vue sur le jardin, cette maison de vacances dispose d'une terrasse, de 2 chambres, d'un salon, d'une télévision à écran plat, d'une cuisine équipée avec un réfrigérateur et un four, ainsi que de 2 salles de bains avec une douche.
Le parcours de golf de Digne se trouve à 44 km. L'aéroport de Marseille-Provence, le plus proche, est implanté à 101 km. 
"
18,Gorges du Verdon,Le Petit Grillo - Gite proche des gorges du Verdon,https://www.booking.com/hotel/fr/le-petit-grillo-gite-proche-du-verdon.fr.html,9.1,43.79256561,6.02551939,"Situé à Allemagne-en-Provence, à 31 km d'ITER / Cadarache et à 35 km du golf du Luberon, l'établissement Le Petit Grillo - Gite proche des gorges du Verdon propose un hébergement climatisé avec une terrasse et une connexion Wi-Fi gratuite. Offrant une vue sur le jardin, il se trouve à 45 km du parcours de golf de Digne et à 2,1 km d'Allemagne-en-Provence.
Cet appartement comprend une chambre, une télévision à écran plat, un lave-linge et une salle de bains pourvue d'une douche. Sa cuisine est équipée d'un micro-ondes et d'un lave-vaisselle. Pour plus de commodité, l'établissement peut fournir des serviettes et du linge de lit moyennant des frais supplémentaires.
Vous pourrez profiter d'une terrasse. Lors de votre séjour, vous pourrez profiter d'un jardin avec un barbecue. La région est prisée pour pratiquer la randonnée et la plongée avec tuba.
Vous séjournerez à 7,9 km d'Albiosc et à 10 km de Montagnac. L'aéroport de Marseille-Provence, le plus proche, est implanté à 102 km. 
"
18,Gorges du Verdon,Les Canyons du Verdon,https://www.booking.com/hotel/fr/les-canyons-du-verdon.fr.html,7.4,43.85067238,6.50822997,"Situé dans le parc régional du Verdon, l'établissement Les Canyons du Verdon dispose d'une piscine extérieure avec chaises longues, d'un jardin et d’un terrain de pétanque. Le lac de Castillon est à seulement 4,5 km. Vous bénéficierez gratuitement d’une connexion Wi-Fi dans l’ensemble des locaux.
Décorées dans des couleurs fraîches, toutes les chambres disposent d'une entrée privée, tandis que certaines comprennent un balcon, une vue sur la piscine ou le jardin et une télévision. Elles sont dotées d’une salle de bains privative.
Un petit-déjeuner buffet est servi sur place. Vous trouverez des bars, des restaurants et des magasins dans le village de Castellane, à seulement 250 mètres.
Une salle de conférence est disponible sur demande. Elle peut accueillir jusqu'à 20 personnes.
L’hôtel est à 15 minutes de marche de la chapelle de Notre-Dame du Roc et à 20 minutes de route de Saint-André-les-Alpes. Vous pourrez profiter gratuitement d’un parking privé sur place et d’une connexion Wi-Fi à la réception. Un local à motos est également disponible gratuitement. 
"
18,Gorges du Verdon,"Villa Borghese, The Originals Relais",https://www.booking.com/hotel/fr/villa-borghese.fr.html,7.5,43.75813877,5.89472026,"Situé à Gréoux-les-Bains, entre les gorges du Verdon et le Lubéron, l'établissement Villa Borghese vous accueille dans un parc entouré de chênes centenaires. Il dispose d'une piscine extérieure chauffée avec terrasse et d'un centre de bien-être.
Offrant une vue sur le jardin, ses chambres intimes sont équipées de la climatisation et d'une télévision par satellite. Leur salle de bains privative est pourvue d'une baignoire et d'articles de toilette gratuits. Une connexion Wi-Fi est disponible gratuitement.
Recommandé par les guides de voyages et de restaurants, le restaurant gastronomique situé sur place, La Table de Pauline, sert le petit-déjeuner chaque matin et une cuisine provençale. Le Côté Jardin propose quant à lui des repas dans un cadre décontracté.
Un court de tennis et un sauna sont également à votre disposition sur place. Le Villa Borghese se trouve à 14 km de l'autoroute A51 et à 16 km de Manosque. La gare TGV d'Aix-en-Provence se situe à 70 km. Un parking privé est disponible gratuitement sur place. 
"
18,Gorges du Verdon,Lou Paradou,https://www.booking.com/hotel/fr/hotellouparadou.fr.html,8.7,43.76062200,5.88897400,"L'hôtel Lou Paradou vous accueille à Gréoux-les-Bains, au bord du Verdon, au milieu des champs de lavande du cœur de la Provence. Il est situé dans un grand parc et dispose d'une piscine extérieure chauffée ouverte en saison, d'un sauna infrarouge et d'un hammam.
Les studios climatisés sont équipés d'une kitchenette, d'une connexion Wi-Fi gratuite ainsi que d'un balcon ou d'une terrasse privé. Certains offrent une vue sur le parc et sont pourvus de la climatisation.
Le matin, un petit-déjeuner composé de confitures faites maison ainsi que de fruits au sirop est servi. L'établissement se situe à seulement 400 mètres du centre piétonnier du village de Gréoux. Un parking gratuit est disponible sur place.
Lors de votre séjour à l'établissement Lou Paradou, vous pourrez découvrir les gorges du Verdon, le plus grand canyon d'Europe, et les villages du Lubéron ainsi que ceux de Haute-Provence, perchés sur les collines. Dans les environs de Gréoux, vous pourrez pratiquer des activités telles que la randonnée, le VTT, la descente en eaux vives, le parapente et l'escalade.
L'aéroport de Marseille Provence est distant de 80 km, tandis que la gare TGV d'Aix-en-Provence se trouve à 70 km. 
"
18,Gorges du Verdon,Camping La Ferme de Castellane,https://www.booking.com/hotel/fr/camping-la-ferme-de-castellane.fr.html,8.8,43.83862066,6.54142499,"Installé dans le village de Castellane, le Camping La Ferme de Castellane se situe sur les berges de la rivière, à 5 minutes de route des gorges du Verdon. L’établissement comprend un terrain de pétanque et une connexion Wi-Fi gratuite dans les parties communes. Sur place, vous pourrez également jouer au ping-pong.
Décorés avec simplicité avec un mobilier en bois, tous les chalets et les mobile homes incluent une télévision par câble et une terrasse privée. Leur salle de bains privative est munie d’une douche. Établis en lisière de la forêt, tous les types d'hébergements offrent une vue sur la montagne.
Les kitchenettes du Camping La Ferme de Castellane sont équipées d’un micro-ondes, d’un réfrigérateur et de plaques de cuisson. Sur place, vous profiterez également d’un barbecue. La propriété dispose d'une piscine chauffée ainsi que d'hébergements insolites.
Une laverie et une aire de jeux pour enfants sont également à votre disposition. Vous pourrez regarder les chaînes du bouquet Canal+ dans la salle de télévision pourvue d’une bibliothèque, d’un baby-foot et de jeux de société.
Le camping se trouve à 2,3 km du cœur de Castellane et à 65 km de Grasse. Il marque le point de départ du sentier de randonnée GR 4. Sur place, le stationnement privé est gratuit. 
"
18,Gorges du Verdon,Ferme de Bourras,https://www.booking.com/hotel/fr/camping-a-la-ferme-de-bourras.fr.html,8.8,43.78247417,6.35027342,"Situé à La Palud-sur-Verdon, le Ferme de Bourras propose des hébergements avec une connexion Wi-Fi gratuite et un coin salon.
Dotés d'une terrasse offrant une vue sur la montagne, tous les logements comprennent une cuisine équipée d'un grille-pain, d'un réfrigérateur, de plaques de cuisson, d'une bouilloire et d'une machine à café.
Ce camping dispose d'un barbecue.
Dans les environs, vous pourrez faire du vélo.
Vous séjournerez à 7 km des gorges du Verdon. Enfin, l'aéroport de Nice-Côte d'Azur, le plus proche, se trouve à 108 km du Ferme de Bourras. 
"
18,Gorges du Verdon,Domaine de Majastre,https://www.booking.com/hotel/fr/domaine-de-majastre.fr.html,8.1,43.68153674,6.22550905,"Située à 9 km de Bauduen et à 24 km de Moustiers-Sainte-Marie, dans le sud-est de la France, cette maison d'hôtes propose une piscine extérieure avec chaises longues, un jardin avec terrasse et un bar sur place. Le lac de Sainte-Croix et les gorges du Verdon sont accessibles en quelques minutes en voiture.
Les chambres du Domaine de Majastre comprennent une salle de bains privative avec douche et articles de toilette gratuits, une radio et un téléphone. Toutes les chambres disposent d'une télévision par câble à écran plat et d'une connexion Wi-Fi gratuite. Le linge de lit et les serviettes sont fournis.
Un petit-déjeuner continental composé d'une sélection de viennoiseries, de confitures maison et de fruits est servi tous les jours.
Le Domaine de Majastre possède un restaurant sur place et propose une cuisine locale raffinée. Tous les plats sont préparés à partir de produits de leurs fermes et certifiés biologiques.
Un parking privé est disponible gratuitement sur place. Plusieurs sentiers de randonnée et pistes cyclables partent de l'établissement et la gare d'Arc-sur-Argens est à 30 km. 
"
18,Gorges du Verdon,Terres de France - Résidence Côté Provence,https://www.booking.com/hotel/fr/residence-cote-provence.fr.html,7.5,43.75720200,5.89661000,"Situé à Gréoux-les-Bains, Le Terres de France - Résidence Côté Provence propose des hébergements avec une terrasse ou un balcon, une connexion Wi-Fi gratuite, une télévision à écran plat, une piscine extérieure ouverte en saison et un jardin.
Tous les logements comprennent la climatisation, une salle de bains privative ainsi qu'une cuisine équipée d'un réfrigérateur, d'un lave-vaisselle, d'un micro-ondes et de plaques de cuisson. Un grille-pain, une machine à café et une bouilloire sont également fournis.
Vous séjournerez à 19 km d'ITER/Cadarache et à 23 km du golf du Luberon. L'aéroport de Marseille-Provence, le plus proche, est implanté à 90 km. 
"
18,Gorges du Verdon,La Clorinde,https://www.booking.com/hotel/fr/holiday-home-la-clorinde.fr.html,9.1,43.83828039,6.22067034,"Située au cœur d'une oliveraie, à 800 mètres du village de Moustiers, La Clorinde est idéalement située pour découvrir les Gorges du Verdon (1.5Km) et apprécier la beauté du lac de Sainte Croix (3Km) et des champs de lavande.
Les chambres spacieuses, lumineuses, calmes et climatisées offrent une vue sur le jardin et les montagnes.
Petit déjeuner (3 formules), dîner, préparé avec des produits locaux, sera servi sur la terrasse et vous fera apprécier les charmes de la gastronomie provençale.
Nous vous proposons gratuitement un parking et un accès Wifi très puissant. Un service de blanchisserie est également assuré.
Nous parlons 3 langues: français, anglais, espagnol
Toutes vos demandes sont les bienvenues. La Clorinde, havre de paix, fera tout son possible pour que votre séjour en Provence soit une expérience inoubliable. 
"
18,Gorges du Verdon,Château et Golf De Taulane,https://www.booking.com/hotel/fr/chateau-et-golf-de-taulane.fr.html,8.4,43.77393376,6.61947986,"L'hôtel 4 étoiles Château et Golf De Taulane vous accueille à 20 km des gorges du Verdon, dans un cadre exceptionnel avec un parcours de golf de 18 trous. Il est pourvu de chambres élégantes et d'excellentes installations. La ville de Grasse est à 40 km.
Les chambres sont aménagées dans le château datant du XVIIIe siècle et dans le manoir. Elles sont décorées avec goût dans un style provençal traditionnel. Pour votre confort, des peignoirs, des chaussons et des articles de toilette gratuits seront mis à votre disposition.
Le restaurant de l'établissement sert une cuisine de qualité préparée par un cuisinier de talent. Un bar et une variété de services hôteliers haut de gamme vous seront en outre proposés.
Vous bénéficierez d'un accès gratuit à la piscine, au sauna, au spa et au bain à remous.
L'établissement Château et Golf De Taulane se trouve à 20 minutes en voiture de Castellane et à 50 km de Draguignan. Un parking gratuit est présent sur place. 
"
18,Gorges du Verdon,La Bastide du Calalou; BW Signature Collection,https://www.booking.com/hotel/fr/bastide-du-calalou.fr.html,8.5,43.65436638,6.16950452,"La Bastide Du Calalou est située à 30 minutes de route des Gorges du Verdon et à 20 minutes en voiture du lac de Sainte-Croix. Elle dispose d'une piscine extérieure chauffée, d'un court de tennis et de chambres élégantes donnant sur la vallée d'Aups.
Les chambres sont équipées d'une connexion Wi-Fi gratuite ainsi que d'une télévision par satellite à écran plat. Certaines sont munies d'un lecteur DVD et de vidéo.
Un petit-déjeuner buffet complet est servi tous les matins. Vous pourrez déguster une cuisine régionale préparée avec des produits locaux au restaurant de l'établissement. Vous pourrez déjeuner et dîner à l'intérieur du restaurant ou sur la terrasse.
La Bastide Du Calalou se trouve à proximité du village de Tourtour et du marché de la truffe noire, le troisième plus important de France, qui se tient de décembre à avril. 
"
