city_id,city_name,name,booking_link,score,lat,lon,descr
1,Mont Saint Michel,Gites les 2 Clos au pied du Mont,https://www.booking.com/hotel/fr/les-deux-clos-pontorson.fr.html,8.9,48.61396610,-1.48579173,"Doté d'un service de prêt de vélos, l'établissement Gites les 2 Clos au pied du Mont propose des hébergements à Ardevon.
Toutes les maisons de vacances disposent d'une salle de bains privative, d'une télévision à écran plat, d'une cuisine entièrement équipée et d'une terrasse. Vous pourrez profiter d'une terrasse dans chaque hébergement.
Une plancha est à votre disposition.
Vous séjournerez à 39 km de Saint-Malo et à 3,1 km du Mont-Saint-Michel. L'aéroport le plus proche, celui de Saint-Malo-Dinard-Pleurtuit, est situé à 44 km. 
"
1,Mont Saint Michel,Au Mont Chez Nous Jaccuzi et Sauna,https://www.booking.com/hotel/fr/26-route-de-la-rive-ardevon.fr.html,9.2,48.61345530,-1.48587230,"Situé à Pontorson, à 8,6 km de l'abbaye du Mont-Saint-Michel, l'établissement Au Mont Chez Nous Jaccuzi et Sauna propose un jardin, une connexion Wi-Fi gratuite, une cuisine et un salon communs. Situé à 21 km du Scriptorial d'Avranches, le musee des manuscrits Vous profiterez d'un barbecue et d'un parking privé gratuit.
Offrant une vue sur le jardin, cette maison de vacances dispose d'une terrasse, de 3 chambres, d'un salon, d'une télévision à écran plat, d'une cuisine équipée avec un réfrigérateur et un four, ainsi que de 2 salles de bains avec une douche. Les serviettes et le linge de lit sont fournis.
La maison de vacances possède également un espace bien-être, où vous pourrez profiter d'un sauna et d'un bain à remous. Un service de location de vélos est assuré sur place.
Vous séjournerez à 46 km de la gare de Granville et à 47 km du zoo de Champrepus. L'aéroport de Rennes-Saint-Jacques, le plus proche, est implanté à 85 km. 
"
1,Mont Saint Michel,Maison au pied du Mont Saint Michel,https://www.booking.com/hotel/fr/maison-au-pied-du-mont-saint-michel.fr.html,9.2,48.61267358,-1.48553065,"Offrant une vue sur le jardin, la Maison au pied du Mont Saint Michel propose un hébergement avec une terrasse et une bouilloire, à environ 21 km du Scriptorial d'Avranches, musee des manuscrits. du Mont Saint-Michel. Situé à 8,7 km de l'abbaye du Mont-Saint-Michel, il dispose d'un jardin et d'un parking privé gratuit.
Cette maison de vacances comprend une chambre, une cuisine avec micro-ondes, une télévision à écran plat, un coin salon et une salle de bains avec douche.
Vous pourrez profiter d'un barbecue sur place et faire de la randonnée dans les environs.
La gare de Granville se trouve à 46 km. L'aéroport de Rennes-Saint-Jacques, le plus proche, est à 75 km. 
"
1,Mont Saint Michel,Mon Saint Michel,https://www.booking.com/hotel/fr/mon-saint-michel.fr.html,8.8,48.61362700,-1.48579100,"Situé à Ardevon, le Mon Saint Michel propose une connexion Wi-Fi gratuite, un service de prêt de vélos, un jardin et une terrasse.
Les chambres comprennent une télévision à écran plat ainsi qu'une salle de bains privative pourvue d'articles de toilette gratuits, d'un sèche-cheveux et d'une douche. La cuisine est équipée d'un réfrigérateur, d'un lave-vaisselle, d'un micro-ondes et d'une machine à café.
Le Mon Saint Michel sert un petit-déjeuner continental ou à la carte.
Vous pourrez pratiquer la randonnée à pied et à vélo dans les environs.
Vous séjournerez à 8,6 km de l'abbaye du Mont-Saint-Michel et à 8,6 km du Scriptorial d'Avranches, musee des manuscrits. Le Mont-Saint-Michel se trouve à 21 km. L'aéroport le plus proche, celui de Rennes-Saint-Jacques, est situé à 85 km. Un service de navette aéroport peut être assuré moyennant des frais supplémentaires. 
"
1,Mont Saint Michel,Vent des Grèves,https://www.booking.com/hotel/fr/vent-des-greves-pontorson.fr.html,9.2,48.61540300,-1.49144000,"Offrant une vue sur le jardin, le Vent des Grèves est situé à Pontorson, à 8,1 km de l'abbaye du Mont-Saint-Michel. Vous bénéficierez gratuitement d'une connexion Wi-Fi et d'un parking privé.
Cette chambre d'hôtes dispose d'une télévision et d'une salle de bains privative avec sèche-cheveux, articles de toilette gratuits et douche.
Le Vent des Grèves sert un petit-déjeuner buffet ou continental.
Une terrasse est également à votre disposition.
Après une journée de randonnée ou de vélo, vous pourrez vous détendre dans le jardin ou le coin salon commun.
Scriptorial d'Avranches, musee des manuscrits Le Vent des Grèves se trouve à 21 km du Mont-Saint-Michel et à 45 km de la gare de Granville. L'aéroport de Rennes-Saint-Jacques, le plus proche, est implanté à 95 km. 
"
1,Mont Saint Michel,Etoile des Grèves,https://www.booking.com/hotel/fr/etoile-des-greves.fr.html,9.3,48.61550900,-1.49152400,"Situé à 8,1 km de l'abbaye du Mont-Saint-Michel, l'Etoile des Grèves propose des hébergements avec connexion Wi-Fi et parking privé gratuits.
Leur salle de bains privative est pourvue d'une douche et d'un sèche-cheveux.
Cette chambre d'hôtes sert un petit-déjeuner buffet ou continental.
L'Etoile des Grèves possède une terrasse.
Après une journée de randonnée ou de vélo, vous pourrez vous détendre dans le jardin ou le coin salon commun.
Scriptorial d'Avranches, musee des manuscrits Vous séjournerez à 21 km du Mont-Saint-Michel et à 45 km de la gare de Granville. L'aéroport de Rennes-Saint-Jacques, le plus proche, est implanté à 93 km. 
"
1,Mont Saint Michel,Hôtel la Croix Blanche,https://www.booking.com/hotel/fr/ha-el-la-croix-blanche.fr.html,7.6,48.63573406,-1.50986105,"Situé au cœur du village médiéval du Mont-Saint-Michel, l'Hôtel La Croix Blanche possède une terrasse et un bar.
Les chambres de l'Hôtel La Croix Blanche disposent d'une télévision par satellite à écran plat et d'un minibar. Gratuit Une connexion Wi-Fi est disponible gratuitement.
En plus de la visite du Mont-Saint-Michel et de son abbaye, vous pourrez vous rendre à Saint-Malo, à 50 km de l'hôtel. La gare de Dol-de-Bretagne est à 30 km. 
"
1,Mont Saint Michel,L'Hirondelle,https://www.booking.com/hotel/fr/l-39-hirondelle-pontorson.fr.html,8.9,48.61579500,-1.48871200,"La maison de vacances L'Hirondelle, située à Pontorson, possède une terrasse et une cuisine entièrement équipée.
Composée de 3 chambres, elle dispose aussi d'une salle de bains avec douche et sèche-cheveux. Une télévision par satellite à écran plat est mise à votre disposition. Vous apprécierez la vue sur le Mont-Saint-Michel, situé à 5 km.
La commune de Cancale se trouve à 48 km. L'aéroport de Dinard-Bretagne, le plus proche, est situé à 57 km de l'hébergement L'Hirondelle. 
"
1,Mont Saint Michel,Auberge Saint Pierre,https://www.booking.com/hotel/fr/auberge-saint-pierre.fr.html,7.9,48.63568798,-1.50988251,"L'Auberge Saint-Pierre occupe une maison à colombages du XIVe siècle située au Mont-Saint-Michel, une île accessible à marée basse. Elle allie le charme d'époque des poutres apparentes à des éléments de confort moderne comme une télévision et une connexion Wi-Fi gratuite. 
Les chambres de l'Auberge Saint Pierre disposent d'une salle de bains privative avec une baignoire ou une douche. Certaines offrent une vue sur la mer. 
L'établissement sert un petit-déjeuner buffet tous les matins. Vous pourrez prendre vos repas au restaurant authentique présent sur place qui sert une cuisine normande traditionnelle et des plats de poisson.
Installé dans la rue principale menant à l'abbaye, cet hôtel constitue un pied-à-terre idéal pour visiter le mont Saint-Michel. Certaines chambres se trouvent dans 2 bâtiments séparés accessibles par de nombreuses marches. 
"
1,Mont Saint Michel,Hotel Gabriel,https://www.booking.com/hotel/fr/hotel-gabriel.fr.html,7.9,48.61538141,-1.51070997,"L’Hotel Gabriel se trouve à 1,6 km du Mont-Saint-Michel. L’établissement est à seulement 25 minutes à pied des remparts de la vieille ville. Il propose une connexion Wi-Fi gratuite ainsi que des chambres avec salle de bains privative.
Accessibles par des escaliers, les chambres spacieuses de l'hôtel comprennent la télévision par satellite. Chaque hébergement dispose d’une salle de bains pourvue d’une douche.
Un petit-déjeuner buffet est disponible tous les matins. La Rôtisserie sert des spécialités normandes et bretonnes.
L’Hotel Gabriel est situé à 6 minutes en voiture de l’autoroute E401. Vous séjournerez également à 7,3 km de la gare TGV de Pontorson qui dessert Paris. 
"
1,Mont Saint Michel,Auberge de la Baie,https://www.booking.com/hotel/fr/auberge-de-la-baie.fr.html,7.8,48.61599318,-1.48825318,"Situé dans la campagne normande, cet hôtel dispose d’une connexion Wi-Fi gratuite.
Toutes les chambres modernes de l'Auberge de la Baie sont équipées d'une télévision par satellite à écran plat, d'une salle de bains privative et d'un sèche-cheveux.
Un petit-déjeuner buffet est servi chaque matin.
Un parking gratuit est disponible sur place et la ville d'Avranches se trouve à 23 km. Vous séjournerez à 45 minutes en voiture des plages de Saint-Malo et à 1 heure de route de Rennes. 
"
1,Mont Saint Michel,Le Saint Aubert,https://www.booking.com/hotel/fr/hotel-saint-aubert.fr.html,7.0,48.61293783,-1.51010513,"Niché dans un écrin de verdure, à seulement 2 km du Mont-Saint-Michel, Le Saint Aubert vous accueille dans un cadre chaleureux et convivial.
Cet établissement vous propose des chambres paisibles et confortables entourées de jardins fleuris.
Après une journée de découverte du Mont-Saint-Michel, vous pourrez déguster une délicieuse cuisine régionale dans le cadre pittoresque d'une ancienne ferme.
Le personnel serviable sera heureux de vous recommander un grand nombre de sites d'intérêt et les visites à faire dans la région. 
"
1,Mont Saint Michel,Le Relais Du Roy,https://www.booking.com/hotel/fr/le-relais-du-roy.fr.html,7.8,48.61626270,-1.51090577,"Le Relais Du Roy est un hôtel 3 étoiles situé au bord du Couesnon, à seulement 1,5 km du Mont Saint-Michel et à 50 mètres de la navette gratuite.
Décorées dans un style classique, toutes les chambres comprennent une télévision par satellite à écran plat, un téléphone et un plateau de bienvenue. Elles comprennent également une salle de bains privative pourvue d’une baignoire ou d’une douche, d’articles de toilettes gratuits et d’un sèche-cheveux. Certaines chambres possèdent un balcon.
Un petit-déjeuner buffet est servi tous les matins.
Une épicerie se trouve à moins de 3 minutes à pied. La ville de Pontorson est quant à elle accessible à 7 km. Un espace de stationnement privé est disponible moyennant des frais supplémentaires. 
"
1,Mont Saint Michel,La Vieille Auberge,https://www.booking.com/hotel/fr/la-vieille-auberge-le-mont-saint-michel.fr.html,7.1,48.63606300,-1.51145700,"La Vieille Auberge vous accueille dans le village médiéval du Mont-Saint-Michel, à quelques pas de la célèbre abbaye du Mont-Saint-Michel. L’établissement propose une connexion Wi-Fi gratuite, un restaurant et une terrasse avec vue sur la baie du Mont-Saint-Michel.
Les chambres sont aménagées dans 2 bâtiments annexes et accessibles par de multiples escaliers. Un bâtiment comprend des chambres standard donnant sur la rue principale et l’autre bâtiment, situé en haut du village, abrite des chambres avec vue sur la mer. Tous les logements disposent d’une télévision à écran plat et d’une salle de bains privative avec une baignoire ou une douche.
L’hôtel comporte un bar et un restaurant servant une cuisine française traditionnelle.
Vous séjournerez à 24 km d’Avranches et à 49 km de Cancale. La ville de Dol-de-Bretagne se trouve à 30 km. 
"
1,Mont Saint Michel,Hotel De La Digue,https://www.booking.com/hotel/fr/de-la-digue.fr.html,7.1,48.61688155,-1.51091784,"L'hôtel De La Digue est un établissement traditionnel situé en Normandie, à seulement 5 minutes en navette ou à 30 minutes de marche du Mont-Saint-Michel. La connexion Wi-Fi est gratuite dans l'ensemble des locaux. Le restaurant sur place sert une cuisine française classique et offre une vue panoramique sur le Mont-Saint-Michel.
Spacieuses et joliment décorées, les chambres sont dotées d'une télévision. Certaines chambres doubles donnent sur la rivière Couesnon.
Vous pourrez prendre un verre au bar de l'hôtel ou sur la terrasse. 
"
1,Mont Saint Michel,Le Relais Saint Michel,https://www.booking.com/hotel/fr/le-relais-saint-michel.fr.html,7.8,48.61758727,-1.51039615,"Le Relais Saint Michel vous accueille face à la baie du Mont-Saint-Michel. Les chambres de cet hôtel (à l'exception de la chambre lits jumeaux Saint-Michel avec vue intérieure) possèdent toutes une terrasse privée et certaines vous offrent une vue panoramique sur le Mont-Saint-Michel.
Insonorisées, confortables et spacieuses, les chambres sont dotées d'équipements modernes, dont un minibar et une connexion Wi-Fi gratuite. Leurs salles de bains sont privatives.
Le restaurant de l'hôtel vous servira une cuisine traditionnelle. Lors de votre séjour, vous pourrez prendre un verre ou un repas sur la terrasse qui offre une vue sur le Mont-Saint-Michel.
Un service de navette gratuit s'arrête en face de l'établissement et relie le célèbre Mont-Saint-Michel en seulement 10 minutes. Des gilets de sécurité vous seront proposés si vous souhaitez faire une promenade la nuit. Par ailleurs, si vous arrivez en voiture, vous pourrez profiter d'un espace de stationnement surveillé moyennant des frais supplémentaires. 
"
1,Mont Saint Michel,Mercure Mont Saint Michel,https://www.booking.com/hotel/fr/mont-saint-michel.fr.html,8.2,48.61424653,-1.51054502,"Installé dans des espaces verts à seulement 2 km de l'abbaye du Mont-Saint-Michel, le Mercure Mont Saint Michel propose des chambres spacieuses avec salle de bains privative, un bar-restaurant et de nombreuses places de parking gratuites.
Les chambres du Mercure Mont Saint Michel sont dotées de la climatisation, d'un plateau/bouilloire et d'une télévision par satellite/câble à écran plat.
Le restaurant Le Pré Salé, célèbre dans la région, prépare de délicieux fruits de mer ainsi que des spécialités régionales. Le bar Le Normandy sert des boissons dans un cadre convivial et décontracté.
Le Mercure Mont Saint Michel vous accueille à 6,5 km de Pontorson et à 52 km de Saint-Malo. 
"
1,Mont Saint Michel,Le Mouton Blanc,https://www.booking.com/hotel/fr/le-mouton-blanc-le-mont-saint-michel.fr.html,7.0,48.63602298,-1.50989592,"Situé au pied de l'abbaye, le Mouton Blanc Hotel vous accueille dans son bâtiment historique datant du XIVe siècle. Il propose des chambres confortables avec une décoration simple et accueillante.
Les chambres sont réparties dans 3 bâtiments dont un offre des vues sur le Mont-Saint-Michel et un autre comporte des chambres de style médiéval.
Le restaurant du Mouton Blanc vous servira une cuisine locale traditionnelle dans la salle à manger ou sur la terrasse. Vous dégusterez aussi un petit-déjeuner chaque matin.
Enfin lors de votre séjour au Mouton Blanc Hotel, vous pourrez bénéficier de services personnalisés sur demande pour des visites, des loisirs et d'autres activités. 
"
2,St Malo,LE TIMONIER by Cocoonr,https://www.booking.com/hotel/fr/le-timonier.fr.html,9.0,48.63481900,-2.02082400,"Doté d'une connexion Wi-Fi gratuite et offrant une vue sur la mer, l'établissement LE TIMONIER by Cocoonr est situé au cœur de Saint-Malo, à seulement 300 mètres de la plage des Bas-Sablons et à 1,1 km de celle des Fours à Chaux. Cet appartement se trouve à 2,3 km de la plage de Mole et à 2,5 km de celle d'Eventail.
Cet appartement comprend 2 chambres, un salon, une cuisine entièrement équipée avec un réfrigérateur et une machine à café ainsi qu'une salle de bains pourvue d'une douche et d'un sèche-cheveux. Les serviettes et le linge de lit sont fournis.
Vous séjournerez à 1,5 km de la plage du Rosais et à 2,2 km de celle de Bon Secours. L'aéroport de Jersey, le plus proche, est implanté à 71 km. 
"
1,Mont Saint Michel,Les Terrasses Poulard,https://www.booking.com/hotel/fr/les-terrasses-poulard.fr.html,7.3,48.63534943,-1.51037872,"Occupant 2 bâtiments différents au cœur du Mont-Saint-Michel, l'établissement historique Les Terrasses Poulard propose des hébergements avec une vue sur la baie, le village et la rue.
Décorées dans un style moderne, les chambres sont accessibles par des escaliers. Certaines présentent de grandes fenêtres donnant sur la baie. Toutes sont dotées d'une télévision et d'une salle de bains privative.
Le petit-déjeuner est servi au restaurant de l'Auberge de la Mère Poulard, à 2 minutes à pied. Spécialisé dans la cuisine française et régionale, le restaurant est aussi ouvert pour le déjeuner et le dîner. Vous pourrez également prendre vos repas, des boissons et des collations au restaurant La Confiance sur place.
L'établissement Les Terrasses Poulard comporte un bar, ainsi qu'une réception ouverte 24h/24 avec une bagagerie.
La région constitue un cadre idéal pour diverses activités telles que la pêche, le vélo et la randonnée à pied. 
"
1,Mont Saint Michel,La Mère Poulard,https://www.booking.com/hotel/fr/la-mere-poulard.fr.html,7.1,48.63508532,-1.51053965,"Occupant un bâtiment historique, l'hôtel La Mère Poulard jouit d'un emplacement idéal au cœur du Mont-Saint-Michel. Décorées dans un style classique, ses chambres donnent sur la baie, l'abbaye ou la cité médiévale.
Toutes les chambres de l'hôtel La Mère Poulard sont équipées d'une télévision à écran plat et d'une connexion Wi-Fi gratuite. Leur salle de bains privative comporte une baignoire.
Au prestigieux restaurant de l'hôtel La Mère Poulard, vous pourrez savourer des plats traditionnels dont sa fameuse omelette connue dans le monde entier. Vous pourrez tranquillement prendre un verre au piano-bar qui surplombe la baie du Mont-Saint-Michel.
L'hôtel possède un magasin spécialisé dans les produits gastronomiques régionaux. La réception est ouverte 24h/24.
Vous pourrez choisir parmi de nombreuses activités dont les randonnées pédestres, les balades à vélo ou bien la visite du Mont-Saint-Michel. Avranches se trouve à 23 minutes de route et Saint-Malo à 45 minutes de La Mère Poulard. 
"
2,St Malo,La Conchee,https://www.booking.com/hotel/fr/la-conchee.fr.html,9.5,48.67741279,-1.98646032,"La maison de vacances La Conchée est située à Saint-Malo, dans le quartier de Rothéneuf, à 15 minutes de route de la vieille ville. Offrant des vues sur la mer, elle possède un espace de stationnement privé gratuit sur place.
La maison La Conchee comprend un coin salon, une télévision à écran plat, ainsi qu'une cuisine équipée d'un lave-vaisselle. Vous bénéficierez gratuitement d'une connexion Wi-Fi dans l'ensemble de l'hébergement.
Le casino de Saint-Malo est à 3,8 km et l'aéroport de Saint-Malo-Dinard-Pleurtuit, à 12 km. Vous pourrez vous balader le long de la plage, accessible à 200 mètres, pour rejoindre la vieille ville de Saint-Malo. 
"
2,St Malo,Résidence Neptunia,https://www.booking.com/hotel/fr/residence-neptunia.fr.html,8.8,48.65770146,-1.99967265,"La Résidence Neptunia propose des appartements équipés à Saint-Malo, à 50 mètres de la plage. Vous bénéficiez de l'accès direct aux Thermes Marins et vous serez à 1 km de la célèbre cité corsaire.
Les studios fonctionnels de la Résidence Neptunia sont équipées d'une salle de bains privative et d'une télévision. Vous aurez accès à la piscine d'eau de mer chauffée, au sauna et au hammam des Thermes Marins.
Le Neptunia possède 2 restaurants, dont un gastronomique et un autre qui sert une cuisine française traditionnelle. Vous pourrez vous détendre avec un verre au bar et prendre vos repas sur la terrasse par beau temps.
La Résidence Neptunia comporte une salle de sport, une réception ouverte 24h/24 et une connexion Wi-Fi gratuite dans les studios.
Le port de Saint-Malo est à 1 km, tandis que la vieille ville et la cathédrale sont situés à 2 km de l'hôtel. 
"
2,St Malo,chambre d'hôte et gîte du jardin des corsaires,https://www.booking.com/hotel/fr/le-jardin-des-corsaires.fr.html,9.4,48.64579200,-1.98279300,"Située à Saint-Malo, à moins de 2,3 km de la plage du Sillon, la chambre d'hôte et gîte du jardin des corsaires propose un jardin, des chambres non-fumeurs, une connexion Wi-Fi gratuite et une terrasse. Vous séjournerez à environ 2,4 km de la plage de Rochebonne, à 3,4 km du palais du Grand Large et du casino Barrière Saint-Malo. Vous pourrez profiter d'une vue sur le jardin.
Les chambres comprennent un bureau et une télévision. Leur salle de bains privative est pourvue d'une douche et d'un sèche-cheveux. Certaines chambres comprennent une cuisine équipée d'un four. Vous disposerez également d'un réfrigérateur.
Un petit-déjeuner buffet, continental ou sans gluten est servi sur place.
Vous séjournerez à 3,6 km du fort national et à 4,2 km de la tour Solidor. L'aéroport de Jersey, le plus proche, est implanté à 73 km. 
"
2,St Malo,Hôtel La Porte Saint Pierre-Logis Hôtel Intra Muros,https://www.booking.com/hotel/fr/sarl-porte-saint-pierre.fr.html,8.5,48.64785311,-2.02838570,"L'Hôtel La Porte Saint Pierre-Logis Hôtel Intra Muros est situé à l'intérieur des remparts historiques de la vieille ville de Saint-Malo, à seulement 10 mètres de la plage.
Les chambres de l'établissement sont décorées dans un style contemporain. Elles comprennent une télévision à écran plat ainsi qu'une bouilloire électrique. Toutes sont dotées d'une connexion Wi-Fi gratuite et d'une salle de bains privative. Certaines offrent une vue panoramique sur la mer.
Chaque matin, vous dégusterez un petit-déjeuner buffet.
Une salle de réunion pouvant accueillir jusqu'à 20 personnes est présente sur place.
L'Hôtel La Porte Saint Pierre-Logis Hôtel Intra Muros se trouve à 2 km de la gare de Saint-Malo. Enfin, depuis le port de Saint-Malo à 1,5 km, de nombreuses liaisons par ferry vous permettront de rejoindre les îles Anglo-Normandes et le Royaume-Uni. 
"
2,St Malo,Escale Oceania Saint Malo,https://www.booking.com/hotel/fr/mascottesaintmalo.fr.html,8.0,48.65428009,-2.00883776,"L'Escale Oceania Saint Malo se trouve sur le front de mer, en face de la plage du Sillon, à 14 minutes de marche de la gare de Saint-Malo. Il propose des chambres modernes, une terrasse bien exposée et un service de restauration 24h/24.
Toutes les chambres disposent d'une télévision à écran plat. Certaines offrent une vue sur la mer. La connexion Wi-Fi est gratuite.
Vous profiterez gratuitement d'un ordinateur connecté à Internet et d'une imprimante. Un service de location de vélos est par ailleurs assuré.
L'Escale Oceania Saint Malo sert un petit-déjeuner tous les matins, et vous pourrez également dîner sur place. Des collations sont proposées tout au long de la journée, tandis que des paniers-repas peuvent être préparés si vous souhaitez pique-niquer. 
"
2,St Malo,LES AMARRES - Maison familiale 3 chambres - Jardin et place de parking,https://www.booking.com/hotel/fr/les-amarres-maison-familiale-3-chambres-jardin-et-place-de-parking.fr.html,9.3,48.64768290,-1.99520370,"Situé à moins de 1,9 km de la plage de Rochebonne et à 2,5 km de celle d'Eventail, l'établissement LES AMARRES - Maison familiale 3 chambres - Jardin et place de parking dispose d'une connexion Wi-Fi gratuite et d'une terrasse. Situé à 1,4 km de la plage du Sillon, il possède un jardin et un parking privé gratuit.
Cette maison de vacances comprend 3 chambres, une cuisine avec réfrigérateur et four, ainsi que 2 salles de bains avec douche, articles de toilette gratuits et lave-linge. Les serviettes et le linge de lit sont fournis.
Vous séjournerez à 2,3 km du palais du Grand Large et à 2,4 km du casino Barrière de Saint-Malo. L'aéroport de Jersey, le plus proche, est implanté à 73 km. 
"
2,St Malo,Studio cocooning,https://www.booking.com/hotel/fr/studio-cocooning-saint-malo.fr.html,9.4,48.65537970,-2.00327690,"Situé à Saint-Malo, à seulement 1,2 km de la plage de Rochebonne, le Studio cocooning propose un hébergement avec vue sur le jardin et un parking privé gratuit. Offrant une vue sur la ville, il se trouve à 1,3 km du palais du Grand Large et du casino Barrière Saint-Malo.
Cet appartement comprend une chambre, une kitchenette avec micro-ondes, une télévision à écran plat, un coin salon et une salle de bains avec douche. Pour plus de commodité, l'établissement peut fournir des serviettes et du linge de lit moyennant des frais supplémentaires.
Vous pourrez pêcher à proximité.
Vous séjournerez à 1,5 km du fort national et à 1,9 km du ferry Cale de Dinan. L'aéroport le plus proche, celui de Saint-Malo-Dinard-Pleurtuit, est situé à 9 km. 
"
